{
  "execution_id": "993c9658-1398-4f4a-a936-2038bda88c34",
  "input_hash": "234e2f91f113db77fde375d8523a2d09b4007ebe54c36b2e27307f8a4848937c",
  "output_hash": "a2d78f38d9a7ca806c30bd73cac299f5bb4e247f3f8db7484eabe58579b9ad08",
  "log_hash": "10f417d2b035897ed85aca6947f4fc351fadbb6458786a6c1f0771cab8cbbd74",
  "timestamp": "2025-05-20T12:35:11.598530Z",
  "contract_version": "v2025.05.20",
  "phase_id": "5.2",
  "trigger_metadata": {
    "trigger_id": "019493b1-55e2-48bf-bccb-8c063be0eaae",
    "trigger_type": "webhook"
  },
  "seal_version": "1.0"
}