{
  "execution_id": "9af667f2-782e-451d-9f16-e3ab67011be4",
  "input_hash": "93885dfcdfbd0ce700cf2e6d777ad19bd28f1630aee2fc0c697e5bd732e38d20",
  "output_hash": "25270afa8e3cf48dfa05230bd7c2a9dce2485d9cb47df0efa3a6873253178955",
  "log_hash": "17328b40fcfa050b1fbd11ff013023b3d0e5ea640d9e6b91d2ce17f171e5c998",
  "timestamp": "2025-05-19T15:31:16.254830Z",
  "contract_version": "v2025.05.18",
  "phase_id": "5.2",
  "trigger_metadata": {
    "trigger_id": "e58a47f7-5b01-4fc4-ac10-337546e7eb0f",
    "trigger_type": "webhook"
  },
  "seal_version": "1.0"
}