{
  "execution_id": "7620e87c-c409-4756-8a10-8f45dc9448d4",
  "input_hash": "bf438c54f8a504470796a6865ee85e27c7ed9841d70849d19abb02df0d81cb68",
  "output_hash": "13259b0e2e6e49c2182e224a275f1683d0c9efd78b6f1c46115c0312dfe6381f",
  "log_hash": "64f5d4d48d83982dbf264a2033b9e565275eea2aa6a29bc9af2df7bb391b1200",
  "timestamp": "2025-05-19T14:17:44.000473Z",
  "contract_version": "v2025.05.18",
  "phase_id": "5.2",
  "trigger_metadata": {
    "trigger_id": "858ca495-9cc6-4969-b54e-7f0b5596539f",
    "trigger_type": "webhook"
  },
  "seal_version": "1.0"
}