{
  "execution_id": "68077d10-f7dd-4c34-a2b3-16802d05e316",
  "input_hash": "5b42ac54a7370c7454018eaad1b60e9de45dc4c1a98ec8830a1e07ebde8fe480",
  "output_hash": "ac47a9ff4181ee94fd1e30c7e7f33089d961d8e6dfed9ee65a889ac95c0c8b51",
  "log_hash": "15d45fa49311f570c23868a160b9ab60d8301063d09d46d1972118816d705ca2",
  "timestamp": "2025-05-19T15:12:59.753799Z",
  "contract_version": "v2025.05.18",
  "phase_id": "5.2",
  "trigger_metadata": {
    "trigger_id": "test-trigger-012",
    "trigger_type": "cli"
  },
  "seal_version": "1.0"
}