{
  "execution_id": "7cfaac86-2159-40bd-9f7f-aad6b7dfb24e",
  "input_hash": "fabe805a3be643891685b7cd3a937b2aa8e262e5f5d2966ebbd18c68092d9467",
  "output_hash": "5aa9bb44f72f23319b54b2de70aba04b5723c435c1c207ab23f3b9f05eb5f8d5",
  "log_hash": "3ddcd5f9b66253045bc3c2a6b83a5f9b4fcee86f8b5257b9c39fdff6dfc7e510",
  "timestamp": "2025-05-19T15:02:04.962567Z",
  "contract_version": "v2025.05.18",
  "phase_id": "5.2",
  "trigger_metadata": {
    "trigger_id": "838c062c-16b5-4607-aad9-3fabe828c91e",
    "trigger_type": "webhook"
  },
  "seal_version": "1.0"
}