{
  "execution_id": "fddb639e-7e3a-46a7-a0ff-8a86cdf54991",
  "input_hash": "17f50cb3fe49375ebdc38b49647269c206a36f33fe020697e7986015665f3fd7",
  "output_hash": "f6df9daa1380496aa627e8fea1befea3bc93025cde08850b60dce0e6d88649b5",
  "log_hash": "941de579aba0006d4c78a238a280ba1876cd319f9eb9c73b1e174e305dbbb4b7",
  "timestamp": "2025-05-20T12:20:08.704111Z",
  "contract_version": "v2025.05.20",
  "phase_id": "5.2",
  "trigger_metadata": {
    "trigger_id": "cd45bfd1-0b10-4120-9882-b1b1e20bd32c",
    "trigger_type": "cli"
  },
  "seal_version": "1.0"
}