{
  "execution_id": "09d3a17f-ea60-48dc-b122-59d13441d00e",
  "input_hash": "3c20ab5da565d2a9d87088487cf8ede6dc8f89ca0d7d71f9307709d77ebb9afe",
  "output_hash": "05e86c47b6d5f8b01f1572a475e856cfbcc437ba1748c48a52228cade55d4592",
  "log_hash": "08e8135e4aebe8d9297c82e2b5992b14dd84406725d855324c9a51aada0b23b5",
  "timestamp": "2025-05-19T15:21:15.779310Z",
  "contract_version": "v2025.05.18",
  "phase_id": "5.2",
  "trigger_metadata": {
    "trigger_id": "test-trigger-009",
    "trigger_type": "cli"
  },
  "seal_version": "1.0"
}