{
  "execution_id": "5f0b226a-f9c2-45d0-b85e-17982e170d7f",
  "input_hash": "925a4e4ebd612e3b06ce8bb38cec99fd7cae3e0ef3b47da40c7af0e9123c0831",
  "output_hash": "0781c8332c111bc505ec4cf22ef6310e69ce559ff3dc615d1ab8184019e8cea1",
  "log_hash": "627cd0b71a3bf7e43539cbd850da6fa0b30a4579c0d9f30a37f4e00ca49cb134",
  "timestamp": "2025-05-20T13:28:18.061556Z",
  "contract_version": "v2025.05.20",
  "phase_id": "5.2",
  "trigger_metadata": {
    "trigger_id": "76bccd0e-f9a2-4dcf-9dc9-58279037ea4a",
    "trigger_type": "webhook"
  },
  "seal_version": "1.0"
}