{
  "execution_id": "0e572c23-68df-4fee-b4c0-7dc6059704e1",
  "input_hash": "402c74c47508e2dbf41e43f4f8863bfc39486208a124ea989d8f89b12e3c90e7",
  "output_hash": "fe75f372591a184eae18b79271a004d026393dd228c996f1568932663787c897",
  "log_hash": "30750bec3cc404b11f458066d26fa78d8b43fadf5ef96fa28b5b09dc49e013c9",
  "timestamp": "2025-05-20T12:51:36.049934Z",
  "contract_version": "v2025.05.20",
  "phase_id": "5.2",
  "trigger_metadata": {
    "trigger_id": "90fce630-b037-446d-a011-2434bf70d1d0",
    "trigger_type": "webhook"
  },
  "seal_version": "1.0"
}