{
  "execution_id": "17c00a77-1c3d-455c-959a-cda85da14917",
  "input_hash": "fefdc4746e4565eae99842939295eed9b1f0ed74e9e2e472f2ffd40b20767e6b",
  "output_hash": "e423ef17dcfb29448f5ae822d5f3e340bdab541f7b7df026524871d2ef454333",
  "log_hash": "a8b7606f9658c5f525f3d55c2aa51855bf953962faa4ecba13a9e26896aaf27f",
  "timestamp": "2025-05-19T15:21:16.160525Z",
  "contract_version": "v2025.05.18",
  "phase_id": "5.2",
  "trigger_metadata": {
    "trigger_id": "39a3979a-d92b-4e97-ac01-c98cabd58e8e",
    "trigger_type": "webhook"
  },
  "seal_version": "1.0"
}