{
  "execution_id": "a0ef5bd0-1a60-4c39-b74e-5c9070f3348d",
  "input_hash": "e30d80601efda945117ad7be784b688b7ea306821a19be3b552bb0e31a4580f1",
  "output_hash": "e2fa0b33e72cc559b421320d193d2e93261a53034fa6c58716627da214907a6f",
  "log_hash": "c7a06d0ac5a41321b1c6f3f04c8cc55c68b7636ff1764fe2903aa5b9027975a9",
  "timestamp": "2025-05-20T12:35:11.480302Z",
  "contract_version": "v2025.05.20",
  "phase_id": "5.2",
  "trigger_metadata": {
    "trigger_id": "63eefa08-a865-4b95-a6a0-8dfec98de316",
    "trigger_type": "webhook"
  },
  "seal_version": "1.0"
}