{
  "execution_id": "db347e1f-62d8-4ff4-bd5a-8e287cc92a83",
  "input_hash": "55e92fb31de940419496564038c84bc7546d82ccdfcc4aa607258a4cf9b2eb68",
  "output_hash": "5aeb28c58cb6ce669c46a92ab750172daa6d2cb841cce03a6e32ea55e94b0df7",
  "log_hash": "51941bd36411037b57c273898cbc263abc02e2e8dac4946b9e6126f52530bf49",
  "timestamp": "2025-05-20T14:00:04.473396Z",
  "contract_version": "v2025.05.20",
  "phase_id": "5.2",
  "trigger_metadata": {
    "trigger_id": "test-trigger-011",
    "trigger_type": "cli"
  },
  "seal_version": "1.0"
}