{
  "execution_id": "1adc7dc6-95c4-4109-a5a2-ed9fae7fc22f",
  "input_hash": "bc0dc8cdb1f963069e1b09d0506154fa4a49dbc89a5b906e24e0a390a9307c8b",
  "output_hash": "2ebd6605eb105a1c9fc0776676ac1c2491973065c6105f8f84294596a0bb368c",
  "log_hash": "323ba5467beeb8bbae9db3dc20c841be8c85082f0c290c5c34307b3ee5a194cb",
  "timestamp": "2025-05-20T12:51:35.873123Z",
  "contract_version": "v2025.05.20",
  "phase_id": "5.2",
  "trigger_metadata": {
    "trigger_id": "7a9816da-0f9b-4e4c-88f8-0ad679f70a63",
    "trigger_type": "webhook"
  },
  "seal_version": "1.0"
}