{
  "execution_id": "fe6a5eae-c856-4b6f-a0a6-b1210f012db0",
  "input_hash": "5bd438b9a48680dd74318c74012e23fac1fe665b6b4d11dc2afbf06e4e90515e",
  "output_hash": "6808c033a2c83d0ffa4c9a440ac3a53ebb90518c483631f937bcb05a036ed251",
  "log_hash": "ce35dcdbac10c710dab4b0559ae8fa914d25be405422903b874a560c71f79f77",
  "timestamp": "2025-05-18T23:40:47.496749Z",
  "contract_version": "v2025.05.18",
  "phase_id": "5.2",
  "trigger_metadata": {
    "trigger_id": "0f62198c-e497-4584-958a-c3fa39746f3d",
    "trigger_type": "cli"
  },
  "seal_version": "1.0"
}