{
  "execution_id": "c75920f6-45c9-47fb-9350-fd7376a099be",
  "input_hash": "237e756de3ad738b8ebe214ba0e461b094b712497f19d921de13a935b69df85d",
  "output_hash": "1f657a8fdfae0580c1a82b32d6ee64e8c0028e1376820226ef26e23e40c975d2",
  "log_hash": "014fab511908a486df9c1f64db529c34832864f50fbdcf6bb6e561300e3f2371",
  "timestamp": "2025-05-20T12:31:27.357912Z",
  "contract_version": "v2025.05.20",
  "phase_id": "5.2",
  "trigger_metadata": {
    "trigger_id": "test-trigger-009",
    "trigger_type": "cli"
  },
  "seal_version": "1.0"
}