{
  "execution_id": "2bfd0c30-dd64-44e6-b6a3-ad924f93cf5b",
  "input_hash": "495cab5f06bde63737da8d8138bf8e7364f951d8aae174daf0f6a5a644f5d6fe",
  "output_hash": "673c5dfd3c4919b2889cd28fe54ee56cb08e68a01b22905f9250d1483fe1e7aa",
  "log_hash": "a0972ae4d1a39e2c92682818e61474fcd64dacd02cda0ed74a552976e24820b7",
  "timestamp": "2025-05-20T12:49:00.261296Z",
  "contract_version": "v2025.05.20",
  "phase_id": "5.2",
  "trigger_metadata": {
    "trigger_id": "603d2899-64d9-458c-bac0-a0a0e86e62a2",
    "trigger_type": "webhook"
  },
  "seal_version": "1.0"
}