{
  "execution_id": "91760116-6f07-420a-a068-654858b4a7b2",
  "input_hash": "b434fd919232e1729d593ac0c15af69c72104a4a85808f1082b89da024ba913c",
  "output_hash": "67aa84f1ecc141d54c91c0da681126233e7d9c887454f773e792446e87af3324",
  "log_hash": "2808be56e73718d38d4c4bde1210bd86034bdd8238a438327d2e837d327cdbaf",
  "timestamp": "2025-05-19T15:04:09.100046Z",
  "contract_version": "v2025.05.18",
  "phase_id": "5.2",
  "trigger_metadata": {
    "trigger_id": "11042bbc-c7be-4ffa-a25d-b5f3f4b7a45f",
    "trigger_type": "cli"
  },
  "seal_version": "1.0"
}